cv_oasis_odsis_ppe_novak_2020_panas,Adult (18+),NA,"Targeted/specific, Educational",Affective/mental health,Survey/questionnaire,Likert Scale/selected response,cze,Czech Version of the short Overall Anxiety Severity and Impairment Scale (OASIS) and the Overall Depression Severity and Impairment Scale (ODSIS): Psychometric Properties and Evaluation
cv_oasis_odsis_ppe_novak_2020_dses,Adult (18+),NA,"Targeted/specific, Educational",Affective/mental health,Survey/questionnaire,Likert Scale/selected response,cze,Czech Version of the short Overall Anxiety Severity and Impairment Scale (OASIS) and the Overall Depression Severity and Impairment Scale (ODSIS): Psychometric Properties and Evaluation
cv_oasis_odsis_ppe_novak_2020_rses,Adult (18+),NA,"Targeted/specific, Educational",Affective/mental health,Survey/questionnaire,Likert Scale/selected response,cze,"Rosenberg's Self-Esteem Scale, Czech Version"
fullscaleiq_vocab,Adult (18+),NA,Educational,Cognitive/educational,Test,Likert Scale/selected response,eng,"Full Scale IQ Test (Short-Term Memory, Reasoning, and Verbal)"
fullscaleiq_mentalrotation,Adult (18+),NA,Educational,Cognitive/educational,Test,Likert Scale/selected response,eng,"Full Scale IQ Test (Short-Term Memory, Reasoning, and Verbal)"
fullscaleiq_memory,Adult (18+),NA,Educational,Cognitive/educational,Test,Likert Scale/selected response,eng,"Full Scale IQ Test (Short-Term Memory, Reasoning, and Verbal)"
pass20_klosowska_2025_pass_online,Adult (18+),NA,General/non-specific,"Affective/mental health, Physical health/functioning",Survey/questionnaire,Likert Scale/selected response,pol,The Pain Anxiety Symptoms Scale (Polish Pass-20)
pass20_klosowska_2025_dass_online,Adult (18+),NA,General/non-specific,"Affective/mental health, Physical health/functioning",Survey/questionnaire,Likert Scale/selected response,pol,The Depression Anxiety Stress Scales (Polish Pass-20)
pass20_klosowska_2025_staix_online,Adult (18+),NA,General/non-specific,"Affective/mental health, Physical health/functioning",Survey/questionnaire,Likert Scale/selected response,pol,The State-Trait Anxiety Inventory (Polish Pass-20)
pass20_klosowska_2025_pass_hospital,Adult (18+),NA,General/non-specific,"Affective/mental health, Physical health/functioning",Survey/questionnaire,Likert Scale/selected response,pol,"Polish Pass-20, Hospital Sample"
ilearnathome_regalado_2025,Adult (18+),NA,Educational,"Other, Behavioral",Survey/questionnaire,Likert Scale/selected response,spa,I Learn at Home: Pedagogical Use of ICT in Distance Education during the Pandemic in Peru
machivallianism_test_main,Adult (18+),NA,Educational,"Cognitive/educational, Behavioral",Test,Likert Scale/selected response,NA,20-question MACH-IV scale
rvkdcs_romiacg_miroshnik_2020_bfi,Mixed,NA,Educational,"Cognitive/educational, Personality",Test,Likert Scale/selected response,rus,Big Five Inventory - 2 (Russian Validation)
rvkdcs_romiacg_miroshnik_2020_kdocs,Mixed,NA,Educational,"Cognitive/educational, Behavioral",Test,Likert Scale/selected response,rus,Russian validation of Kaufman Domains of Creativity Scale: Relationship to occupation and measurement invariance across gender
environment_ltm,Adult (18+),NA,General/non-specific,Opinion/attitude,Survey/questionnaire,Constructed Response,NA,"British Social Attitudes Survey, 1990"
science_ltm,Mixed,Adolescent (12-18y),General/non-specific,Opinion/attitude,Observational rating,Constructed Response,NA,"Euro-barometer 38.1: Consumer Protection and Perceptions of Science and Technology, November 1992"
prepadherence_zissette_2021,Adult (18+),NA,"Clinical, Targeted/specific",Physical health/functioning,Survey/questionnaire,Likert Scale/selected response,NA,Replication Data for: Adaptation and validation of simple tools to screen and monitor for oral PrEP adherence
mmf_solis_2020,NA,NA,NA,NA,NA,NA,NA,Replication Data for: Measuring Media Freedom: An Item Response Theory Analysis of Existing Indicators
ppsrs_caliciuri_2024,Adult (18+),NA,"Educational, Targeted/specific",Cognitive/educational,Survey/questionnaire,Likert Scale/selected response,ita,Psychometric properties of the Scientific Reasoning Scale: application to the Italian context
dmct_addis_2020_mct,Adult (18+),NA,Educational,Cognitive/educational,Survey/questionnaire,Mixed,ger,"Measuring visual, auditory, and tactile mental imagery using a mental comparison task"
neurips_2020,Child (<18y),"Child (6-12y), Adolescent (12-18y)",Educational,Cognitive/educational,Survey/questionnaire,Likert Scale/selected response,eng,NeurIPS 2020 Education Challenge
mindfulness_assessment,Adult (18+),NA,Clinical,Cognitive/educational,Survey/questionnaire,Likert Scale/selected response,eng,Kentucky Inventory of Mindfulness Skills Assessment
moralfoundations_vignette,Adult (18+),NA,Educational,Opinion/attitude,Survey/questionnaire,Likert Scale/selected response,eng,Developing brief versions of the Moral Foundations Vignettes using a genetic algorithm-based approach
human_learning_rate,Child (<18y),Child (6-12y),Educational,Cognitive/educational,Observational rating,Mixed,eng,An astonishing regularity in student learning rate
humor_styles,Adult (18+),NA,Educational,Personality,Survey/questionnaire,Likert Scale/selected response,eng,Humor Styles Questionnaire
dscore_asq_weber_2019,Child (<18y),Early (<6y),NA,Developmental,Survey/questionnaire,Likert Scale/selected response,eng,Ages & Stages Questionnaires-3
dscore_barrera_weber_2019,Child (<18y),Early (<6y),NA,Developmental,Observational rating,Likert Scale/selected response,spa,Barrera Moncada
dscore_battelle_weber_2019,Child (<18y),Early (<6y),NA,Developmental,Survey/questionnaire,Mixed,eng,Battelle Development Inventory and Screener-2
dscore_bayley_weber_2019,Child (<18y),Early (<6y),NA,Developmental,Observational rating,Likert Scale/selected response,eng,Bayley Scales for Infant and Toddler Development-1/3
dscore_denver_weber_2019,Child (<18y),Early (<6y),NA,Developmental,Observational rating,Likert Scale/selected response,eng,Denver-2
dscore_dutch_weber_2019,Child (<18y),Early (<6y),NA,Developmental,Observational rating,Likert Scale/selected response,dut,Dutch Development Instrument (Van Wiechen Schema)
dscore_griffiths_weber_2019,Child (<18y),Early (<6y),NA,Developmental,Observational rating,Likert Scale/selected response,eng,Griffiths Mental Development Scales
dscore_macarthur_weber_2019,Child (<18y),Early (<6y),NA,Developmental,Observational rating,Likert Scale/selected response,eng,MacArthur Communicative Development Inventory
dscore_mds_weber_2019,Child (<18y),Early (<6y),NA,Developmental,Observational rating,Likert Scale/selected response,eng,WHO Motor Development Milestones
dscore_pegboard_weber_2019,Child (<18y),Early (<6y),NA,Developmental,Observational rating,Likert Scale/selected response,eng,Pegboard
dscore_sbi_weber_2019,Child (<18y),Early (<6y),NA,Developmental,Observational rating,Likert Scale/selected response,eng,Stanford Binet Intelligence Scales-4/5
dscore_vineland_weber_2019,Child (<18y),Early (<6y),NA,Developmental,Observational rating,Likert Scale/selected response,eng,Vineland Social Maturity Scale
gilbert_meta_101,Adult (18+),NA,Clinical,Affective/mental health,Survey/questionnaire,Slider/continuous,eng,Depression Symptom Dynamics
chile_2023_children-adolescents-survey_cp_a,Mixed,NA,"Representative, Targeted/specific",Opinion/attitude,Survey/questionnaire,Likert Scale/selected response,spa,Cuidador Principal
chile_2023_children-adolescents-survey_cp_c,Mixed,NA,"Representative, Targeted/specific",Opinion/attitude,Survey/questionnaire,Mixed,spa,Cuidador Principal
chile_2023_children-adolescents-survey_n,Child (<18y),"Early (<6y), Child (6-12y)","Targeted/specific, Representative",Opinion/attitude,Survey/questionnaire,Mixed,spa,EANNA 2023 - NN
chile_2023_children-adolescents-survey_aa,Child (<18y),"Child (6-12y), Adolescent (12-18y)","Targeted/specific, Representative",Opinion/attitude,Survey/questionnaire,Mixed,spa,EANNA 2023 - NNA
chile_2023_children-adolescents-survey_k,Child (<18y),"Child (6-12y), Adolescent (12-18y)","Targeted/specific, Representative","Opinion/attitude, Affective/mental health",Survey/questionnaire,Likert Scale/selected response,spa,EANNA 2023 - Autoaplicado
chile_2023_children-adolescents-survey_g,Child (<18y),"Child (6-12y), Adolescent (12-18y)","Targeted/specific, Representative","Opinion/attitude, Affective/mental health",Survey/questionnaire,Likert Scale/selected response,spa,EANNA 2023 - Autoaplicado
gilbert_meta_32,Child (<18y),Child (6-12y),Educational,Cognitive/educational,Observational rating,Mixed,spa,Data of the Randomized Controlled Trial for the ESMATE project in El Salvador (Lower secondary level) from 2018 to 2019
gilbert_meta_25,Child (<18y),Child (6-12y),Educational,"Physical health/functioning, Opinion/attitude",Observational rating,Constructed Response,nep,Replication Data for: Nudging children toward healthier food choices: an experiment combining school and home gardens
fgsis_berzeviczy_2018,Adult (18+),NA,Targeted/specific,"Opinion/attitude, Affective/mental health",Test,Likert Scale/selected response,eng,Assessing the validity and reliability of Female Genital Self-Image Scale in a UK population of healthy women over twenty
coach_chen_2022_iadl,Elderly (minimum age >50),NA,Clinical,Affective/mental health,Observational rating,Constructed Response,chi,The Chinese Older Adult Collaborations in Health (COACH) Study
gilbert_meta_49,Mixed,Early (<6y),Clinical,Physical health/functioning,Observational rating,Constructed Response,NA,Data from the cluster-randomized controlled trial of the Kusamala Program
gilbert_meta_15,Child (<18y),Child (6-12y),Educational,"Cognitive/educational, Developmental",Observational rating,Mixed,NA,Partnership Schools for Liberia
coach_chen_2022_hdrs,Elderly (minimum age >50),NA,Clinical,Affective/mental health,Observational rating,Mixed,NA,The Chinese Older Adult Collaborations in Health (COACH) Study
gilbert_meta_40,Child (<18y),Child (6-12y),Educational,"Developmental, Behavioral",Observational rating,Mixed,NA,Replication Data for: When Student Incentives Don't Work: Evidence from a Field Experiment in Malawi
gilbert_meta_50,Mixed,Early (<6y),Clinical,Developmental,Observational rating,Mixed,NA,"Replication Data for: ""Using community health workers to deliver a scalable integrated parenting program in rural China: A cluster-randomized controlled trial"""
roar_gijbels2024,Child (<18y),"Early (<6y), Child (6-12y)",Educational,Developmental,Observational rating,Mixed,NA,Rapid online assessment of reading and phonological awareness (ROAR-PA)
gilbert_meta_30,Mixed,Child (6-12y),Educational,Developmental,Test,Likert Scale/selected response,hin,The Impact of Maternal Literacy and Participation Programs: Evidence from a Randomized Evaluation in India
coach_chen_2022_phq9,Elderly (minimum age >50),NA,Clinical,Affective/mental health,Observational rating,Constructed Response,chi,The Chinese Older Adult Collaborations in Health (COACH) Study
gilbert_meta_14,Child (<18y),Child (6-12y),Educational,"Cognitive/educational, Developmental",Observational rating,Mixed,NA,Partnership Schools for Liberia
gilbert_meta_12,Child (<18y),Child (6-12y),Educational,"Cognitive/educational, Developmental",Survey/questionnaire,Likert Scale/selected response,NA,"Improving Elementary Grade Students’ Science and Social Studies Vocabulary Knowledge Depth, Reading Comprehension, and Argumentative Writing: A Conceptual Replication"
gilbert_meta_98,Adult (18+),NA,Educational,"Cognitive/educational, Developmental",Survey/questionnaire,Likert Scale/selected response,NA,"A short, animated storytelling video to boost psychological capital"
machivallianism_test_vcl,Adult (18+),NA,General/non-specific,"Opinion/attitude, Behavioral",Test,Likert Scale/selected response,eng,The MACH-IV test of Machiavellianism
pemaiw_qiu_2020_mlq,Adult (18+),NA,"Clinical, Targeted/specific",Physical health/functioning,Survey/questionnaire,Likert Scale/selected response,eng,Psychedelic Experience and Mindfulness are Associated with Improved Wellbeing - The Meaning in Life Questionnaire
k-pcq_huh_2022,Adult (18+),NA,Educational,"Opinion/attitude, Affective/mental health",Test,Likert Scale/selected response,NA,Reliability and Validity of the Korean version of the Pornography Craving Questionnaire (K-PCQ) Based on the Classical Test Theory and Item Response Theory
gilbert_meta_21,Child (<18y),Child (6-12y),Educational,Developmental,Observational rating,Mixed,NA,Improving Children's Understanding of Mathematical Equivalence: An Efficacy Study
gilbert_meta_51,Mixed,Early (<6y),Clinical,Developmental,Observational rating,Mixed,NA,"Replication Data for: ""Using community health workers to deliver a scalable integrated parenting program in rural China: A cluster-randomized controlled trial"""
gilbert_meta_20,Child (<18y),Child (6-12y),Educational,"Developmental, Cognitive/educational",Test,Mixed,NA,Impact of a Tier 2 Fractions Intervention on 5th Grade At-Risk Students’ Fractions Achievement
coach_chen_2022_csq,Elderly (minimum age >50),NA,Clinical,Affective/mental health,Observational rating,Constructed Response,chi,The Chinese Older Adult Collaborations in Health (COACH) Study
gilbert_meta_43,Adult (18+),NA,"Clinical, Educational","Affective/mental health, Cognitive/educational",Observational rating,Constructed Response,NA,THE PSYCHOSOCIAL VALUE OF EMPLOYMENT: EVIDENCE FROM A REFUGEE CAMP
gilbert_meta_38,Adult (18+),NA,Clinical,"Cognitive/educational, Physical health/functioning",Survey/questionnaire,Likert Scale/selected response,NA,Entertainment-Education for Better Health: Insights from a Field Experiment in India
gilbert_meta_35,Mixed,Adolescent (12-18y),Educational,"Personality, Opinion/attitude",Survey/questionnaire,Likert Scale/selected response,eng,Does Deliberative Education Increase Civic Competence? Results from a Field Experiment
pmt_trzcinska_2023_mvs,Child (<18y),Early (<6y),Educational,"Developmental, Personality",Test,Likert Scale/selected response,pol,The role of income inequalities in building materialistic aspirations of new generations
coach_chen_2022_adl,Elderly (minimum age >50),NA,Clinical,Affective/mental health,Observational rating,Constructed Response,chi,The Chinese Older Adult Collaborations in Health (COACH) Study
gilbert_meta_97,Adult (18+),NA,Educational,"Cognitive/educational, Developmental",Survey/questionnaire,Likert Scale/selected response,NA,"A short, animated storytelling video to boost psychological capital"
gilbert_meta_75,Adult (18+),NA,Educational,"Opinion/attitude, Personality",Survey/questionnaire,Likert Scale/selected response,NA,Couples Therapy for a Divided America: Assessing the Effects of Reciprocal Group Reflection on Partisan Polarization
gilbert_meta_27,Mixed,Child (6-12y),Educational,Developmental,Test,Likert Scale/selected response,hin,The Impact of Maternal Literacy and Participation Programs: Evidence from a Randomized Evaluation in India
gilbert_meta_74,NA,NA,NA,NA,NA,NA,NA,Leveraging Item Parameter Drift to Assess Transfer Effects in Vocabulary Learning
coach_chen_2022_whoqol_bref,Elderly (minimum age >50),NA,Clinical,Affective/mental health,Observational rating,Constructed Response,chi,The Chinese Older Adult Collaborations in Health (COACH) Study
gilbert_meta_39,Child (<18y),Adolescent (12-18y),Educational,"Cognitive/educational, Other",Survey/questionnaire,Likert Scale/selected response,NA,When Student Incentives Don't Work: Evidence from a Field Experiment in Malawi
gilbert_meta_61,Child (<18y),Adolescent (12-18y),"Educational, Targeted/specific","Behavioral, Opinion/attitude",Observational rating,Mixed,afg,Can Economic Assistance Shape Combatant Support in Wartime? Experimental Evidence from Afghanistan
mgsisgclq_hollyhead_2018,Adult (18+),NA,Clinical,"Physical health/functioning, Affective/mental health",Survey/questionnaire,Likert Scale/selected response,NA,Assessing the validity of the Male Genital Self-Image Scale and the Gynaecologic Cancer Lymphedema Questionnaire in a UK population of healthy males over forty
nsr-fc_youhasan_2021,Adult (18+),NA,Educational,Cognitive/educational,Test,Likert Scale/selected response,NA,Development and validation of a measurement scale to assess nursing students’ readiness for the flipped classroom in Sri Lanka
gilbert_meta_69,Child (<18y),Child (6-12y),Educational,Cognitive/educational,Observational rating,Mixed,NA,From Proof of Concept to Scalable Policies' and 'Mainstreaming an Effective Intervention
gilbert_meta_44,Elderly (minimum age >50),NA,Clinical,Affective/mental health,Survey/questionnaire,Likert Scale/selected response,NA,Effectiveness of a mindfulness intervention for older adults to improve emotional well-being and cognitive function in a Chinese population: A randomized waitlist-controlled trial
gilbert_meta_16,Child (<18y),Child (6-12y),Educational,Cognitive/educational,Observational rating,Mixed,NA,The Limitations of Activity-Based Instruction to Improve the Productivity of Schooling
gilbert_meta_29,Mixed,Child (6-12y),Educational,Developmental,Test,Likert Scale/selected response,NA,The Impact of Maternal Literacy and Participation Programs: Evidence from a Randomized Evaluation in India
pemaiw_qiu_2020_swls,Adult (18+),NA,"Clinical, Targeted/specific",Physical health/functioning,Survey/questionnaire,Likert Scale/selected response,eng,Psychedelic Experience and Mindfulness are Associated with Improved Wellbeing - The Satisfaction with Life Scale
parc_balaji_2017,Adult (18+),NA,Educational,Cognitive/educational,Test,Likert Scale/selected response,NA,RELATIONSHIP OF ACADEMIC PROCRASTINATION AND CONSIDERATION OF FUTURE CONSEQUENCES – AN EMPIRICAL STUDY AMONG UNIVERSITY STUDENTS
gilbert_meta_4,Adult (18+),NA,Educational,Behavioral,Observational rating,Mixed,NA,Reducing Crime and Violence: Experimental Evidence from Cognitive Behavioral Therapy in Liberia
gene_likert_aivelo_2020,Mixed,Adolescent (12-18y),Educational,"Cognitive/educational, Opinion/attitude",Survey/questionnaire,Likert Scale/selected response,NA,Factors explaining students’ attitudes towards learning in genetics and belief in genetic determinism
gilbert_meta_41,Child (<18y),Child (6-12y),Educational,"Developmental, Cognitive/educational",Survey/questionnaire,Mixed,NA,Reading skills transfer best from home language to a second language: Policy lessons from two field experiments in South Africa
pemaiw_qiu_2020_bwss,Adult (18+),NA,"Clinical, Targeted/specific",Physical health/functioning,Survey/questionnaire,Likert Scale/selected response,eng,Psychedelic Experience and Mindfulness are Associated with Improved Wellbeing - The Brief Wisdom Screening Scale
gilbert_meta_52,Adult (18+),NA,Clinical,Physical health/functioning,Observational rating,Mixed,NA,Impact of Community Masking on COVID-19: A Cluster-Randomized Trial in Bangladesh
pmt_trzcinska_2023_pmt,Child (<18y),Early (<6y),Educational,"Developmental, Personality",Test,Likert Scale/selected response,pol,The role of income inequalities in building materialistic aspirations of new generations - Pictorial Materialism Test
loneliness_mudfold,Adult (18+),NA,"Clinical, Educational",Cognitive/educational,Survey/questionnaire,Likert Scale/selected response,dut,Manual of the Loneliness Scale
lsat,NA,NA,NA,NA,NA,NA,NA,Fitting a response model for n dichotomously scored items
measuring_lexical_quality,Adult (18+),NA,Educational,Cognitive/educational,Test,Likert Scale/selected response,eng,Measuring Lexical Quality: The Role of Spelling Ability
mental_health_questionnaire_for_the_elderly,Elderly (minimum age >50),NA,Clinical,Affective/mental health,Survey/questionnaire,Likert Scale/selected response,chi,Survey on Anxiety Disorders in the Elderly
mtf,Child (<18y),"Adolescent (12-18y), Child (6-12y)",Educational,Opinion/attitude,Survey/questionnaire,Likert Scale/selected response,eng,Monitoring the Future (MTF) Public-Use Cross-Sectional Datasets
lessr_mach4,Adult (18+),NA,General/non-specific,Cognitive/educational,Survey/questionnaire,Likert Scale/selected response,eng,Machiavellian beliefs and personality: Construct invalidity of the Machiavellianism dimension
amorim_2025_climej_climej,Adult (18+),NA,"Targeted/specific, Representative, ""Internet-based (Mturkers, etc)""",Opinion/attitude,Survey/questionnaire,Likert Scale/selected response,"por, eng",NA
amorim_2025_climej_desenhonotrabalho,Adult (18+),NA,"Targeted/specific, Representative, ""Internet-based (Mturkers, etc)""",Opinion/attitude,Survey/questionnaire,Likert Scale/selected response,"por, eng",NA
amorim_2025_climej_florescimentonotrabalho,Adult (18+),NA,"Targeted/specific, Representative, ""Internet-based (Mturkers, etc)""",Opinion/attitude,Survey/questionnaire,Likert Scale/selected response,"por, eng",NA
amorim_2025_climej_suporteorganizacional,Adult (18+),NA,"Targeted/specific, Representative, ""Internet-based (Mturkers, etc)""",Opinion/attitude,Survey/questionnaire,Likert Scale/selected response,"por, eng",NA
rfq8_wozniakprus_2022,Adult (18+),NA,General/non-specific,Affective/mental health,Survey/questionnaire,Likert Scale/selected response,pol,Reflective Functioning Questionnaire (RFQ-8)
identity_fusion_gomez_2025,Adult (18+),NA,"""Internet-based (Mturkers, etc)"", Targeted/specific",Opinion/attitude,Survey/questionnaire,Mixed,"spa, eng","Identity Fusion, Perceived Self-verification and Willingness to fight and die"
bfi2_zhang_2025,Adult (18+),NA,"Educational, ""Internet-based (Mturkers, etc)""",Personality,Survey/questionnaire,Likert Scale/selected response,eng,The Big Five Inventory-2 (BFI-2) and three Alternative Formats
szczygiel_2023_masa_amas,Adult (18+),NA,"""Internet-based (Mturkers, etc)"", General/non-specific",Opinion/attitude,Survey/questionnaire,Likert Scale/selected response,"pol, eng",The Abbreviated Math Anxiety Scale (AMAS)
szczygiel_2023_masa_maqa,Adult (18+),NA,"""Internet-based (Mturkers, etc)"", General/non-specific",Opinion/attitude,Survey/questionnaire,Likert Scale/selected response,"pol, eng",Math Anxiety Questionnaire for Adults (MAQA)
szczygiel_2023_masa_masa,Adult (18+),NA,"""Internet-based (Mturkers, etc)"", General/non-specific",Opinion/attitude,Survey/questionnaire,Likert Scale/selected response,"pol, eng",The Math Attitude Scale for Adults (MASA)
szczygiel_2023_masa_self-concept.self-efficacy,Adult (18+),NA,"""Internet-based (Mturkers, etc)"", General/non-specific",Opinion/attitude,Survey/questionnaire,Likert Scale/selected response,"pol, eng",Mathematics (MSC) and Polish (PSC) Self‑Concept; Mathematics (MSE) and Polish (PSE) Language Self‑Effi‑ cacy
potocnik_2024_diabetes,Mixed,NA,Targeted/specific,Opinion/attitude,Survey/questionnaire,Likert Scale/selected response,slo,Slovenian versions of DES-LF (S-DES-LF) and S-DES-SF...Diabetes Empowerment Scale
conrad_2013_exploitation_staff_psychology,Elderly (minimum age >50),NA,"Targeted/specific, Clinical","Physical health/functioning, Opinion/attitude, Affective/mental health",Survey/questionnaire,Likert Scale/selected response,eng,Older Adult Mistreatment Assessment (OAMA) Staff Questionnaire
conrad_2013_exploitation_staff_financial,Elderly (minimum age >50),NA,"Targeted/specific, Clinical","Physical health/functioning, Opinion/attitude, Affective/mental health",Survey/questionnaire,Likert Scale/selected response,eng,Older Adult Mistreatment Assessment (OAMA) Staff Questionnaire
conrad_2013_exploitation_client_psychology,Elderly (minimum age >50),NA,"Targeted/specific, Clinical","Physical health/functioning, Opinion/attitude, Affective/mental health",Survey/questionnaire,Likert Scale/selected response,eng,Older Adult Mistreatment Assessment (OAMA) Client Questionnaire
conrad_2013_exploitation_client_financial,Elderly (minimum age >50),NA,"Targeted/specific, Clinical","Physical health/functioning, Opinion/attitude, Affective/mental health",Survey/questionnaire,Likert Scale/selected response,eng,Older Adult Mistreatment Assessment (OAMA) Client Questionnaire
hexaco_silvia_2025,Adult (18+),NA,"""Internet-based (Mturkers, etc)""",Personality,Survey/questionnaire,Likert Scale/selected response,eng,HEXACO-100
sd4_silvia_2025,Adult (18+),NA,"""Internet-based (Mturkers, etc)""",Personality,Survey/questionnaire,Likert Scale/selected response,eng,Short Dark Tetrad Scale (SD4)
shorttripm_silvia_2025,Adult (18+),NA,"""Internet-based (Mturkers, etc)""",Personality,Survey/questionnaire,Likert Scale/selected response,eng,Short TriPM
chexi_lin_2019,Mixed,NA,Educational,Cognitive/educational,Observational rating,Mixed,NA,TC-CHEXI
scs_suh_2023_scs,Adult (18+),NA,Clinical,Affective/mental health,Survey/questionnaire,Likert Scale/selected response,kor,"The 10-Item Version Singelis’s Self-Construal Scale (SCS-Short Version) for Korean Adults: Psychometric Properties, Measurement Invariance with European Americans, and Associations with Social Anxiety"
genpsych_russell_2024_gpt3.5,Adult (18+),NA,"Clinical, Educational",Cognitive/educational,Survey/questionnaire,Likert Scale/selected response,eng,Generative Psychometrics via AI-GENIE: Automatic Item Generation and Validation via Network-Integrated Evaluation
gilbert_meta_77,Mixed,Early (<6y),Educational,Cognitive/educational,Survey/questionnaire,Likert Scale/selected response,eng,Clinical Evaluation of Language Fundamentals—Fourth Edition Sentence Structure subtest
hrs_cesd,Adult (18+),NA,Clinical,Affective/mental health,Observational rating,Mixed,eng,Documentation of Affective Functioning Measures in the Health and Retirement Study
hrs_health,Adult (18+),NA,Clinical,Affective/mental health,Observational rating,Mixed,eng,Documentation of Affective Functioning Measures in the Health and Retirement Study
bafacalo_golino_2013_bvps,Child (<18y),Adolescent (12-18y),Educational,"Cognitive/educational, Developmental",Test,Likert Scale/selected response,bra,"Data from the BAFACALO project: The Brazilian Intelligence Battery based on two state-of-the-art models: Carroll's model and the CHC model, Broad visual perception subtest"
