Filename,Description,URL,Reference,Original License,Public Reshare?,Derived License,Notes,Contributor,Date,Measurement Focus,Response Type,Target Population,Domain of Measurement,Scoring Methodology,Data Structure,Data Source,Context of Use,Item Format,Geographic Location
PSR-P_Scale_Intimacy_Hakim_2018_Study3,attitudes towards politics and authorities,https://dataverse.harvard.edu/dataset.xhtml?persistentId=doi:10.7910/DVN/F3KS7M,"Hakim, M. (2018, December 13). Measuring the feeling of distant intimacy with politicians:  Development, construct validity, and replicability of the parasocial relationship with a political figure  (PSR-P) scale. https://doi.org/10.31234/osf.io/mcwsg

Hakim, Moh Abdul, 2018, ""Measuring the feeling of distant intimacy with political figures across cultures: Development, construct validity, factor replicability, and measurement invariance of parasocial relationship with political figures (PSR-P) scale"", https://doi.org/10.7910/DVN/F3KS7M, Harvard Dataverse, V1",CC0 1.0,Public,CC0 1.0,,arthur,9-30-2024,Political Attitudes,Unknown,Unknown,Social Attitudes,Unknown,Unknown,Unknown,Unknown,Unknown,Unknown
FACES_Spanish_Vegas_2022_FACES,Family Adaptability and Cohesion Evaluation Scale Package (FACES IV).,https://dataverse.harvard.edu/dataset.xhtml?persistentId=doi:10.7910/DVN/UA5GTO,"María Isabel Vegas, 2022, ""FACES IV Package for Spanish Adolescents"", https://doi.org/10.7910/DVN/UA5GTO, Harvard Dataverse, V2

Vegas, M. I., Mateos-Agut, M., Pineda-Otaola, P. J., & Sebastián-Vega, C. (2022). Psychometric properties of the FACES IV package for Spanish adolescents. Psicologia: Reflexão e Crítica, 35, 18.",CC0 1.0,Public,CC0 1.0,,arthur,9-30-2024,Unknown,Unknown,Unknown,Unknown,Unknown,Unknown,Unknown,Unknown,Unknown,Unknown
FACES_Spanish_Vegas_2022_FSS,family satisfaction scale (fss),https://dataverse.harvard.edu/dataset.xhtml?persistentId=doi:10.7910/DVN/UA5GTO,"María Isabel Vegas, 2022, ""FACES IV Package for Spanish Adolescents"", https://doi.org/10.7910/DVN/UA5GTO, Harvard Dataverse, V2

Vegas, M. I., Mateos-Agut, M., Pineda-Otaola, P. J., & Sebastián-Vega, C. (2022). Psychometric properties of the FACES IV package for Spanish adolescents. Psicologia: Reflexão e Crítica, 35, 18.",CC0 1.0,Public,CC0 1.0,,arthur,9-30-2024,Unknown,Unknown,Unknown,Unknown,Unknown,Unknown,Unknown,Unknown,Unknown,Unknown
RD_PPCSEDSOF_Afable_2023,Center for Epidemiological Studies - Depression (CES-D) Scale in older Filipinos.,https://dataverse.harvard.edu/dataset.xhtml?persistentId=doi:10.7910/DVN/UT9RVL,"Afable, Sanny Boy; Cruz, Grace Trinidad; Saito, Yasuhiko, 2023, ""Replication Data for: Psychometric Properties of the CES-D Scale in Older Filipinos"", https://doi.org/10.7910/DVN/UT9RVL, Harvard Dataverse, V1, UNF:6:Sz8/8a1aaU/q4PPwsdwpdw== [fileUNF]",CC0 1.0,Public,CC0 1.0,,arthur,10-1-2024,Health/Well-being,Unknown,Older Filipinos,Depression,Unknown,Unknown,Unknown,Unknown,Unknown,Unknown
QaSLu_lopez_2024,Questionnaire for the Self-assessment of University Service-learning Experiences (QaSLu),https://dataverse.harvard.edu/dataset.xhtml?persistentId=doi:10.7910/DVN/LUUDQC,"López-de-Arana Prado, E.; Aramburuzabala, P.; Cerrillo, R.; Sánchez-Cabrero, R. Validation and Standardization of a Questionnaire for the Self-Assessment of Service-Learning Experiences in Higher Education (QaSLu-27). Educ. Sci. 2024, 14, 615. https://doi.org/10.3390/educsci14060615 doi: https://www.mdpi.com/2227-7102/14/6/615


López de Arana Prado, Elena; Sánchez-Cabrero, Roberto; Aramburuzabala, Pilar; Cerrillo, Rosario, 2024, ""Dataset of the initial validation of Questionnaire for the Self-assessment of University Service-learning Experiences (QaSLu)"", https://doi.org/10.7910/DVN/LUUDQC, Harvard Dataverse, V3, UNF:6:0G58Cn2FWIOPS6cx7++mzg== [fileUNF]",CC0 1.0,Public,CC0 1.0,,arthur,10-1-2024,Unknown,Unknown,Unknown,Unknown,Unknown,Unknown,Unknown,Unknown,Unknown,Unknown
ada_boredom_bieleke2022,Dealing with boredom scale,https://osf.io/nbw95/,"Bieleke, M., Ripper, L., Schüler, J., & Wolff, W. (2022). Boredom is the root of all evil—or is it? A psychometric network approach to individual differences in behavioural responses to boredom. Royal Society open science, 9(9), 211998.",CC-By Attribution 4.0 International ,Public,CC-By Attribution 4.0 International ,,bd,10-1-2024,Unknown,Unknown,Unknown,Unknown,Unknown,Unknown,Unknown,Unknown,Unknown,Unknown
beh_boredom_bieleke2022,Adaptive and maladaptive behaviors,https://osf.io/nbw95/,"Bieleke, M., Ripper, L., Schüler, J., & Wolff, W. (2022). Boredom is the root of all evil—or is it? A psychometric network approach to individual differences in behavioural responses to boredom. Royal Society open science, 9(9), 211998.",CC-By Attribution 4.0 International ,Public,CC-By Attribution 4.0 International ,,bd,10-1-2024,Unknown,Unknown,Unknown,Unknown,Unknown,Unknown,Unknown,Unknown,Unknown,Unknown
bae_boredom_bieleke2022,Boredom avoidance and escape,https://osf.io/nbw95/,"Bieleke, M., Ripper, L., Schüler, J., & Wolff, W. (2022). Boredom is the root of all evil—or is it? A psychometric network approach to individual differences in behavioural responses to boredom. Royal Society open science, 9(9), 211998.",CC-By Attribution 4.0 International ,Public,CC-By Attribution 4.0 International ,,bd,10-1-2024,Unknown,Unknown,Unknown,Unknown,Unknown,Unknown,Unknown,Unknown,Unknown,Unknown
bps_boredom_bieleke2022,Boredom proneness scale,https://osf.io/nbw95/,"Bieleke, M., Ripper, L., Schüler, J., & Wolff, W. (2022). Boredom is the root of all evil—or is it? A psychometric network approach to individual differences in behavioural responses to boredom. Royal Society open science, 9(9), 211998.",CC-By Attribution 4.0 International ,Public,CC-By Attribution 4.0 International ,,bd,10-1-2024,Unknown,Unknown,Unknown,Unknown,Unknown,Unknown,Unknown,Unknown,Unknown,Unknown
EWAS_Sanford_2024_Flourish,Flourishing Scale,https://osf.io/4td6k/,"Sanford, K., & Elkins, G. (2024). The Everyday Wellbeing Appraisal Scale: Assessing a type of subjective well-being uniquely associated with health behavior in people with hypertension. Psychological Assessment.",CC-By Attribution 4.0 International,Public,CC-By Attribution 4.0 International,,savira,10-2-2024,Health/Well-being,Unknown,Unknown,Unknown,Unknown,Unknown,Unknown,Unknown,Unknown,Unknown
EWAS_Sanford_2024,Everyday Wellbeing Appraisal Scale,https://osf.io/4td6k/,"Sanford, K., & Elkins, G. (2024). The Everyday Wellbeing Appraisal Scale: Assessing a type of subjective well-being uniquely associated with health behavior in people with hypertension. Psychological Assessment.",CC-By Attribution 4.0 International,Public,CC-By Attribution 4.0 International,,savira,10-2-2024,Well-being,Unknown,Unknown,Unknown,Unknown,Unknown,Unknown,Unknown,Unknown,Unknown
gilbert_meta_74,Assessment from a literacy intervention,https://dataverse.harvard.edu/dataset.xhtml?persistentId=doi:10.7910/DVN/ZF1LKZ,"Gilbert, J. B., Kim, J. S., & Miratrix, L. W. (2024). Leveraging item parameter drift to assess transfer effects in vocabulary learning. Applied Measurement in Education, 37(3), 240-257.",CC BY-NC-SA 4.0,Public,CC BY-NC-SA 4.0,Data modified for inclusion in IRW. License available here. https://creativecommons.org/licenses/by-nc-sa/4.0/,,,Literacy Intervention,Unknown,Unknown,Unknown,Unknown,Unknown,Unknown,Unknown,Unknown,Unknown
kfcovid_fear_Li2020,Fear of COVID,https://osf.io/m2v3h/,"Li, D. C. Y., & Leung, L. (2020). Psychometric data on knowledge and fear of coronavirus disease 2019 and perceived stress among workers of filipino origin in Hong Kong. Data in brief, 33, 106395.",CC-By Attribution 4.0 International ,Public,CC-By Attribution 4.0 International ,,monica chen,10-3-2024,Health/Well-being,unknown,unknown,unknown,unknown,unknown,unknown,unknown,unknown,unknown
kfcovid_Li2020,Knowledge of COVID,https://osf.io/m2v3h/,"Li, D. C. Y., & Leung, L. (2020). Psychometric data on knowledge and fear of coronavirus disease 2019 and perceived stress among workers of filipino origin in Hong Kong. Data in brief, 33, 106395.",CC-By Attribution 4.0 International ,Public,CC-By Attribution 4.0 International ,,monica chen,10-3-2024,Health/Well-being,Unknown,Unknown,Unknown,Unknown,Unknown,Unknown,Unknown,Unknown,Unknown
kfcovid_pss_Li2020,Perceived stress scale,https://osf.io/m2v3h/,"Li, D. C. Y., & Leung, L. (2020). Psychometric data on knowledge and fear of coronavirus disease 2019 and perceived stress among workers of filipino origin in Hong Kong. Data in brief, 33, 106395.",CC-By Attribution 4.0 International ,Public,CC-By Attribution 4.0 International ,,monica chen,10-3-2024,Health/Well-being,Unknown,Unknown,Unknown,Unknown,Unknown,Unknown,Unknown,Unknown,Unknown
PRCPSFFMQ_Lecuona_2017,Five Facets Mindfulness Questionnaire,https://osf.io/m64wp/,"Lecuona, O., García-Garzón, E., García-Rubio, C., & Rodríguez-Carvajal, R. (2020). A psychometric review and conceptual replication study of the Five Facets Mindfulness Questionnaire latent structure. Assessment, 27(5), 859-872.",CC0 1.0 Universal ,Public,CC0 1.0 Universal ,,arthur,10-3-2024,Unknown,Unknown,Unknown,Unknown,Unknown,Unknown,Unknown,Unknown,Unknown,Unknown
NAMPRB_Siwiak_2024_AOT,Actively Open-minded Thinking Scale(AOT),https://osf.io/k2453/,"Siwiak, A., Buczel, K. A., Rabińska, W., & Szpitalak, M. (2024). New Age of measuring paranormal and related beliefs: Psychometric properties and correlates of the Polish version of the Survey of Scientifically Unaccepted Beliefs (SSUB).",,Public,CC BY 4.0,Permission via email,arthur,10-3-2024,Unknown,Unknown,Unknown,Unknown,Unknown,Unknown,Unknown,Unknown,Unknown,Unknown
NAMPRB_Siwiak_2024_BSR10,Bullshit Receptivity Scale–shortened version (BSR_10),https://osf.io/k2453/,"Siwiak, A., Buczel, K. A., Rabińska, W., & Szpitalak, M. (2024). New Age of measuring paranormal and related beliefs: Psychometric properties and correlates of the Polish version of the Survey of Scientifically Unaccepted Beliefs (SSUB).",,Public,CC BY 4.0,Permission via email,arthur,10-3-2024,Unknown,Unknown,Unknown,Unknown,Unknown,Unknown,Unknown,Unknown,Unknown,Unknown
NAMPRB_Siwiak_2024_DESRPL,Dissociative Experiences Scale–Revised (DES-R-PL),https://osf.io/k2453/,"Siwiak, A., Buczel, K. A., Rabińska, W., & Szpitalak, M. (2024). New Age of measuring paranormal and related beliefs: Psychometric properties and correlates of the Polish version of the Survey of Scientifically Unaccepted Beliefs (SSUB).",,Public,CC BY 4.0,Permission via email,arthur,10-3-2024,Unknown,Unknown,Unknown,Unknown,Unknown,Unknown,Unknown,Unknown,Unknown,Unknown
NAMPRB_Siwiak_2024_GCBS,Generic Conspiracist Beliefs Scale(GCBS),https://osf.io/k2453/,"Siwiak, A., Buczel, K. A., Rabińska, W., & Szpitalak, M. (2024). New Age of measuring paranormal and related beliefs: Psychometric properties and correlates of the Polish version of the Survey of Scientifically Unaccepted Beliefs (SSUB).",,Public,CC BY 4.0,Permission via email,arthur,10-3-2024,Unknown,Unknown,Unknown,Unknown,Unknown,Unknown,Unknown,Unknown,Unknown,Unknown
NAMPRB_Siwiak_2024_KON2066,Kon-2066,https://osf.io/k2453/,"Siwiak, A., Buczel, K. A., Rabińska, W., & Szpitalak, M. (2024). New Age of measuring paranormal and related beliefs: Psychometric properties and correlates of the Polish version of the Survey of Scientifically Unaccepted Beliefs (SSUB).",,Public,CC BY 4.0,Permission via email,arthur,10-3-2024,Unknown,Unknown,Unknown,Unknown,Unknown,Unknown,Unknown,Unknown,Unknown,Unknown
NAMPRB_Siwiak_2024_KOP20,Kwestionariusz Otwartości Przekonań(KOP20),https://osf.io/k2453/,"Siwiak, A., Buczel, K. A., Rabińska, W., & Szpitalak, M. (2024). New Age of measuring paranormal and related beliefs: Psychometric properties and correlates of the Polish version of the Survey of Scientifically Unaccepted Beliefs (SSUB).",,Public,CC BY 4.0,Permission via email,arthur,10-3-2024,Unknown,Unknown,Unknown,Unknown,Unknown,Unknown,Unknown,Unknown,Unknown,Unknown
NAMPRB_Siwiak_2024_NEOFFI,NEO Five Factor Inventory(NEO-FFI),https://osf.io/k2453/,"Siwiak, A., Buczel, K. A., Rabińska, W., & Szpitalak, M. (2024). New Age of measuring paranormal and related beliefs: Psychometric properties and correlates of the Polish version of the Survey of Scientifically Unaccepted Beliefs (SSUB).",,Public,CC BY 4.0,Permission via email,arthur,10-3-2024,Personality Traits,Unknown,Unknown,Unknown,Unknown,Unknown,Unknown,Unknown,Unknown,Unknown
NAMPRB_Siwiak_2024_SSUB,Survey of Scientifically Unaccepted Beliefs(SSUB),https://osf.io/k2453/,"Siwiak, A., Buczel, K. A., Rabińska, W., & Szpitalak, M. (2024). New Age of measuring paranormal and related beliefs: Psychometric properties and correlates of the Polish version of the Survey of Scientifically Unaccepted Beliefs (SSUB).",,Public,CC BY 4.0,Permission via email,arthur,10-3-2024,Unknown,Unknown,Unknown,Unknown,Unknown,Unknown,Unknown,Unknown,Unknown,Unknown
PVPVESQ_Gasiorowska_2021_study2_AQ,,https://osf.io/twzq4/,"Gasiorowska, A., Glomb, K., & Kesebir, P. (2023). Psychometric validation of the polish version of the emotional style questionnaire. Current Psychology, 42(26), 22351-22369.",,,,,,,Unknown,Unknown,Unknown,Unknown,Unknown,Unknown,Unknown,Unknown,Unknown,Unknown
MotAcademica_Ribeiro_2019,Academic Motivation Scale,https://dataverse.harvard.edu/dataset.xhtml?persistentId=doi:10.7910/DVN/KWTMWT,"Ribeiro, M. F., Saraiva, V., Pereira, P., & Ribeiro, C. (2019). Academic Motivation Scale: Validity in Portuguese Public Higher Education/Escala de Motivacao Academica: Validacao no Ensino Superior Publico Portugues. RAC-Revista de Administracao Contemporanea, 23(3), 288-311.

Ribeiro, M.F.; Saraiva, V.; Pereira, P.; Ribeiro, C., 2019, ""Replication Data for: Academic Motivation Scale: Validity in Portuguese Public Higher Education"", https://doi.org/10.7910/DVN/KWTMWT, Harvard Dataverse, V1, UNF:6:Q/6Sa/GXyRr6geeedbpt/w== [fileUNF]
",CC0 1.0,Public,CC0 1.0,,savira,10-7-2024,Unknown,Unknown,Unknown,Unknown,Unknown,Unknown,Unknown,Unknown,Unknown,Unknown
SV-MAIA2_Randelovic_2021_DASS,Depression Anxiety Stress Scales-21 (DASS-21),https://osf.io/em3wf/,"Ranđelović, M., Jokic, B., & Purić, D. (2023). Are dimensions of interoceptive awareness the same for everyone? Serbian validation of MAIA-2 in samples with differing mind-body practice experience. https://osf.io/preprints/psyarxiv/8fdma",CC-By Attribution 4.0 International,Public,CC-By Attribution 4.0 International,,arthur,10-3-2024,Health/Well-being,Unknown,Unknown,Affective Measures,Unknown,Unknown,Unknown,Unknown,Unknown,Unknown
SV-MAIA2_Randelovic_2021_hexaco60,Hexaco 60 item personality inventory,https://osf.io/em3wf/,"Ranđelović, M., Jokic, B., & Purić, D. (2023). Are dimensions of interoceptive awareness the same for everyone? Serbian validation of MAIA-2 in samples with differing mind-body practice experience. https://osf.io/preprints/psyarxiv/8fdma",CC-By Attribution 4.0 International,Public,CC-By Attribution 4.0 International,,arthur,10-3-2024,Personality Traits,Unknown,Unknown,Unknown,Unknown,Unknown,Unknown,Unknown,Unknown,Unknown
SV-MAIA2_Randelovic_2021_delta,DELTA 9 disintegration scale,https://osf.io/em3wf/,"Ranđelović, M., Jokic, B., & Purić, D. (2023). Are dimensions of interoceptive awareness the same for everyone? Serbian validation of MAIA-2 in samples with differing mind-body practice experience. https://osf.io/preprints/psyarxiv/8fdma",CC-By Attribution 4.0 International,Public,CC-By Attribution 4.0 International,,arthur,10-3-2024,Unknown,Unknown,Unknown,Unknown,Unknown,Unknown,Unknown,Unknown,Unknown,Unknown
SV-MAIA2_Randelovic_2021_MAAS,Mindful Attention Awareness Scale,https://osf.io/em3wf/,"Ranđelović, M., Jokic, B., & Purić, D. (2023). Are dimensions of interoceptive awareness the same for everyone? Serbian validation of MAIA-2 in samples with differing mind-body practice experience. https://osf.io/preprints/psyarxiv/8fdma",CC-By Attribution 4.0 International,Public,CC-By Attribution 4.0 International,,arthur,10-3-2024,Unknown,Unknown,Unknown,Unknown,Unknown,Unknown,Unknown,Unknown,Unknown,Unknown
SV-MAIA2_Randelovic_2021_ERQ,Emotion Regulation Questionnaire,https://osf.io/em3wf/,"Ranđelović, M., Jokic, B., & Purić, D. (2023). Are dimensions of interoceptive awareness the same for everyone? Serbian validation of MAIA-2 in samples with differing mind-body practice experience. https://osf.io/preprints/psyarxiv/8fdma",CC-By Attribution 4.0 International,Public,CC-By Attribution 4.0 International,,arthur,10-3-2024,Emotion Regulation,unknown,unknown,Affective Measures,unknown,unknown,unknown,unknown,unknown,unknown
SV-MAIA2_Randelovic_2021_MAIA,interoceptive awareness,https://osf.io/em3wf/,"Ranđelović, M., Jokic, B., & Purić, D. (2023). Are dimensions of interoceptive awareness the same for everyone? Serbian validation of MAIA-2 in samples with differing mind-body practice experience. https://osf.io/preprints/psyarxiv/8fdma",CC-By Attribution 4.0 International,Public,CC-By Attribution 4.0 International,,arthur,10-3-2024,Unknown,Unknown,Unknown,Unknown,Unknown,Unknown,Unknown,Unknown,Unknown,Unknown
SV-MAIA2_Randelovic_2021_hexaco100,Hexaco 100 item personality inventory,https://osf.io/em3wf/,"Ranđelović, M., Jokic, B., & Purić, D. (2023). Are dimensions of interoceptive awareness the same for everyone? Serbian validation of MAIA-2 in samples with differing mind-body practice experience. https://osf.io/preprints/psyarxiv/8fdma",CC-By Attribution 4.0 International,Public,CC-By Attribution 4.0 International,,arthur,10-3-2024,Personality Traits,Unknown,Unknown,Unknown,Unknown,Unknown,Unknown,Unknown,Unknown,Unknown
SV-MAIA2_Randelovic_2021_SHS,Subjective Happiness Scale,https://osf.io/em3wf/,"Ranđelović, M., Jokic, B., & Purić, D. (2023). Are dimensions of interoceptive awareness the same for everyone? Serbian validation of MAIA-2 in samples with differing mind-body practice experience. https://osf.io/preprints/psyarxiv/8fdma",CC-By Attribution 4.0 International,Public,CC-By Attribution 4.0 International,,arthur,10-3-2024,Health/Well-being,Unknown,Unknown,Affective Measures,Unknown,Unknown,Unknown,Unknown,Unknown,Unknown
PPSCMMUSAUK_Keech_2019_Apprais_df,,https://osf.io/6kdgz/,"Keech, J. J., Orbell, S., Hagger, M. S., O’Callaghan, F. V., & Hamilton, K. (2021). Psychometric properties of the stress control mindset measure in university students from Australia and the UK. Brain and Behavior, 11(2), e01963.",,,,,,,Unknown,Unknown,Unknown,Unknown,Unknown,Unknown,Unknown,Unknown,Unknown,Unknown
SABFI2_Gallardo_Pujol_2018_BFI,Big Five Inventory-2 (BFI-2),https://osf.io/kp572/,"Gallardo-Pujol, D., Rouco, V., Cortijos-Bernabeu, A., Oceja, L., Soto, C. J., & John, O. P. (2022). Factor structure, gender invariance, measurement properties, and short forms of the Spanish adaptation of the Big Five Inventory-2. Psychological Test Adaptation and Development.",CC-By Attribution 4.0 International ,Public,CC-By Attribution 4.0 International ,,arthur,10-7-2024,Personality Traits,Unknown,Unknown,Unknown,Unknown,Unknown,Unknown,Unknown,Unknown,Unknown
SABFI2_Gallardo_Pujol_2018_LOT,Life orientation scale,https://osf.io/kp572/,"Gallardo-Pujol, D., Rouco, V., Cortijos-Bernabeu, A., Oceja, L., Soto, C. J., & John, O. P. (2022). Factor structure, gender invariance, measurement properties, and short forms of the Spanish adaptation of the Big Five Inventory-2. Psychological Test Adaptation and Development.",CC-By Attribution 4.0 International ,Public,CC-By Attribution 4.0 International ,,arthur,10-7-2024,Unknown,Unknown,Unknown,Unknown,Unknown,Unknown,Unknown,Unknown,Unknown,Unknown
SABFI2_Gallardo_Pujol_2018_SWB,Subjective happiness scale,https://osf.io/kp572/,"Gallardo-Pujol, D., Rouco, V., Cortijos-Bernabeu, A., Oceja, L., Soto, C. J., & John, O. P. (2022). Factor structure, gender invariance, measurement properties, and short forms of the Spanish adaptation of the Big Five Inventory-2. Psychological Test Adaptation and Development.",CC-By Attribution 4.0 International ,Public,CC-By Attribution 4.0 International ,,arthur,10-7-2024,Health/Well-being,Unknown,Unknown,Unknown,Unknown,Unknown,Unknown,Unknown,Unknown,Unknown
SABFI2_Gallardo_Pujol_2018_Constru,Self-Construal Scale,https://osf.io/kp572/,"Gallardo-Pujol, D., Rouco, V., Cortijos-Bernabeu, A., Oceja, L., Soto, C. J., & John, O. P. (2022). Factor structure, gender invariance, measurement properties, and short forms of the Spanish adaptation of the Big Five Inventory-2. Psychological Test Adaptation and Development.",CC-By Attribution 4.0 International ,Public,CC-By Attribution 4.0 International ,,arthur,10-7-2024,Unknown,Unknown,Unknown,Unknown,Unknown,Unknown,Unknown,Unknown,Unknown,Unknown
SABFI2_Gallardo_Pujol_2018_Micro,Racial microagression scale,https://osf.io/kp572/,"Gallardo-Pujol, D., Rouco, V., Cortijos-Bernabeu, A., Oceja, L., Soto, C. J., & John, O. P. (2022). Factor structure, gender invariance, measurement properties, and short forms of the Spanish adaptation of the Big Five Inventory-2. Psychological Test Adaptation and Development.",CC-By Attribution 4.0 International ,Public,CC-By Attribution 4.0 International ,,arthur,10-7-2024,Unknown,Unknown,Unknown,Unknown,Unknown,Unknown,Unknown,Unknown,Unknown,Unknown
SABFI2_Gallardo_Pujol_2018_Tight,Tightness-looseness scale,https://osf.io/kp572/,"Gallardo-Pujol, D., Rouco, V., Cortijos-Bernabeu, A., Oceja, L., Soto, C. J., & John, O. P. (2022). Factor structure, gender invariance, measurement properties, and short forms of the Spanish adaptation of the Big Five Inventory-2. Psychological Test Adaptation and Development.",CC-By Attribution 4.0 International ,Public,CC-By Attribution 4.0 International ,,arthur,10-7-2024,Unknown,Unknown,Unknown,Unknown,Unknown,Unknown,Unknown,Unknown,Unknown,Unknown
SABFI2_Gallardo_Pujol_2018_Honest,Hexaco honesty-humility subscale,https://osf.io/kp572/,"Gallardo-Pujol, D., Rouco, V., Cortijos-Bernabeu, A., Oceja, L., Soto, C. J., & John, O. P. (2022). Factor structure, gender invariance, measurement properties, and short forms of the Spanish adaptation of the Big Five Inventory-2. Psychological Test Adaptation and Development.",CC-By Attribution 4.0 International ,Public,CC-By Attribution 4.0 International ,,arthur,10-7-2024,Personality Traits,Unknown,Unknown,Unknown,Unknown,Unknown,Unknown,Unknown,Unknown,Unknown
SABFI2_Gallardo_Pujol_2018_Narq,Narcissism admiration and rivalry questionnaire,https://osf.io/kp572/,"Gallardo-Pujol, D., Rouco, V., Cortijos-Bernabeu, A., Oceja, L., Soto, C. J., & John, O. P. (2022). Factor structure, gender invariance, measurement properties, and short forms of the Spanish adaptation of the Big Five Inventory-2. Psychological Test Adaptation and Development.",CC-By Attribution 4.0 International ,Public,CC-By Attribution 4.0 International ,,arthur,10-7-2024,Personality Traits,Unknown,Unknown,Unknown,Unknown,Unknown,Unknown,Unknown,Unknown,Unknown
SABFI2_Gallardo_Pujol_2018_Trust,Trustworthiness scale,https://osf.io/kp572/,"Gallardo-Pujol, D., Rouco, V., Cortijos-Bernabeu, A., Oceja, L., Soto, C. J., & John, O. P. (2022). Factor structure, gender invariance, measurement properties, and short forms of the Spanish adaptation of the Big Five Inventory-2. Psychological Test Adaptation and Development.",CC-By Attribution 4.0 International ,Public,CC-By Attribution 4.0 International ,,arthur,10-7-2024,Unknown,Unknown,Unknown,Unknown,Unknown,Unknown,Unknown,Unknown,Unknown,Unknown
SABFI2_Gallardo_Pujol_2018_IntHapp,Interdependent happiness scale,https://osf.io/kp572/,"Gallardo-Pujol, D., Rouco, V., Cortijos-Bernabeu, A., Oceja, L., Soto, C. J., & John, O. P. (2022). Factor structure, gender invariance, measurement properties, and short forms of the Spanish adaptation of the Big Five Inventory-2. Psychological Test Adaptation and Development.",CC-By Attribution 4.0 International ,Public,CC-By Attribution 4.0 International ,,arthur,10-7-2024,Health/Well-being,Unknown,Unknown,Affective Measures,Unknown,Unknown,Unknown,Unknown,Unknown,Unknown
SABFI2_Gallardo_Pujol_2018_ReligionScale,Centrality of religion scale,https://osf.io/kp572/,"Gallardo-Pujol, D., Rouco, V., Cortijos-Bernabeu, A., Oceja, L., Soto, C. J., & John, O. P. (2022). Factor structure, gender invariance, measurement properties, and short forms of the Spanish adaptation of the Big Five Inventory-2. Psychological Test Adaptation and Development.",CC-By Attribution 4.0 International ,Public,CC-By Attribution 4.0 International ,,arthur,10-7-2024,Unknown,Unknown,Unknown,Unknown,Unknown,Unknown,Unknown,Unknown,Unknown,Unknown
RD_PpCvDOS_PadcOnaCns_Jinbo_2019_DOS,Duesseldorf Orthorexia Scale,https://dataverse.harvard.edu/dataset.xhtml?persistentId=doi:10.7910/DVN/F4UYZQ,"He, Jinbo, 2019, ""Replication Data for: Psychometric properties of the Chinese version of the Duesseldorf Orthorexia Scale - Prevalence and demographic correlates of Orthorexia nervosa among Chinese university students"", https://doi.org/10.7910/DVN/F4UYZQ, Harvard Dataverse, V1, UNF:6:3aX2gYvPpoOWxIvwRfO3iQ== [fileUNF]

He, J., Ma, H., Barthels, F., & Fan, X. (2019). Psychometric properties of the Chinese version of the Düsseldorf Orthorexia Scale: prevalence and demographic correlates of orthorexia nervosa among Chinese university students. Eating and Weight Disorders-Studies on Anorexia, Bulimia and Obesity, 24, 453-463.",CC0 1.0,Public,CC0 1.0,,arthur,10-8-2024,Health/Well-being,Unknown,Unknown,Unknown,Unknown,Unknown,Unknown,Unknown,Unknown,Unknown
