Filename,Description,URL,Reference,Original License,Public Reshare?,Derived License,Notes,Contributor,Date,Measurement Focus,Response Type,Target Population,Domain of Measurement,Scoring Methodology,Data Structure,Data Source,Context of Use,Item Format,Geographic Location
vocab_assessment_3_to_8_year_old_children,Receptive vocabulary task (in German) for children 3-8,https://github.com/ccp-eva/vocab,"Bohn, M., Prein, J. C., Delikaya, B., Haun, D. B. M., & Gagarina, N. (2022, August 24). oREV: an Item Response Theory based open receptive vocabulary task for 3 to 8-year-old children. https://doi.org/10.31234/osf.io/4z86w",Creative Commons Attribution 4.0 International,Public,CC BY 4.0,Data modified from original on 5-5-2023. Original license: https://github.com/ccp-eva/vocab/blob/main/LICENSE,Belen Chavez,,Educational Ability,Unknown,Children 3-8,Cognitive Skills,Unknown,Unknown,Test-based,Educational Assessment,Unknown,Unknown
vocabulary_iq,Data on vocabulary knowledge and personality items,http://openpsychometrics.org/_rawdata/,(2018). Vocabulary IQ Test [dataset and codebook]. http://openpsychometrics.org/_rawdata/VIQT_data.zip,,Public,CC BY 4.0,,LCM,,Personality Traits,Unknown,Unknown,Unknown,Unknown,Unknown,Unknown,Educational Assessment,Unknown,Global
western_reserve_project,"Longitudinal, item-level data from the Western Reserve Reading and Math Project, which concerned child development among twins",https://ldbase.org/datasets/3e02149d-f1a2-45ba-910e-c85a14cdf1c6,"Petrill, S., Thompson, L., Plomin, R., DeThorne, L. S., & Schatschneider, C. (2021). WRRMP Full data (all waves). LDbase. https://doi.org/10.33009/ldbase.1643647104.07c5
","Open Data Commons Attribution License (ODC-By)
",Public,CC BY 4.0,,LCM,,Child Development,Unknown,Twins,"Reading, Math, Behavioral, Environmental Measures",Unknown,Longitudinal,Unknown,Educational Assessment,Unknown,Unknown
wirs,Attitudinal items involving workplace negotiations.,https://cran.r-project.org/web/packages/ltm/index.html,"Bartholomew, D. (1998) Scaling unobservable constructs in social science. Applied Statistics, 47, 1–13.",GPL-2 | GPL-3 ,Public,GPL-3,Data modified from original on 1-25-2023,BD,,Workplace Negotiations,Dichotomous and Polytomous,Unknown,Attitudinal,Item Response Theory,Unknown,Unknown,Unknown,Unknown,Unknown
wordsum,Ten item vocabulary test included in General Social Suvey (https://en.wikipedia.org/wiki/Wordsum),https://gss.norc.org/get-the-data/stata,"Malhotra, N., Krosnick, J. A., & Haertel, E. (2007). The psychometric properties of the GSS Wordsum vocabulary test. GSS Methodological Report, 11, 1-63.",,,,,BD,,Educational Ability,Unknown,Adults,Cognitive Skills,Unknown,Cross-sectional,Survey-based,Unknown,Unknown,Unknown
wpi_math_assistments,"Items from online algebra tutoring, assessing whether students get the item correct on the first attempt",https://pslcdatashop.web.cmu.edu/Files?datasetId=92,"Heffernan, N. (2010). 2004-2005 question level data [data set]. DataShop @ CMU. https://pslcdatashop.web.cmu.edu/Files?datasetId=92",,,,,LCM,,Educational Ability,Dichotomous,Students,Cognitive Skills,Unknown,Unknown,Unknown,Educational Assessment,Unknown,Unknown
NARQing,Data from the Narcissistic Admiration and Rivalry Questionnaire (NARQ) along with Rosenberg self-esteem (RSE) and Multigroup Ethnic Identity Measure (MEIM).,https://osf.io/3g4sw,"Chou, E., Westberg, D. W., Nguyen, P. L., & Syed, M. (2023, October 28). The Structure and Correlates of the Narcissistic Admiration and Rivalry Questionnaire among U.S. Racial/Ethnic Groups. https://doi.org/10.31234/osf.io/w3rxe",CC-By Attribution 4.0 International ,Public,,,BD,2-2-2024,Personality Traits,Unknown,Unknown,Psychological,Unknown,Unknown,Unknown,Unknown,Questionnaire-based,Unknown
promis1wave1_anger,Data from the Anger scale in the Wave 1 PROMIS study. ,https://dataverse.harvard.edu/dataset.xhtml?persistentId=hdl:1902.1/21134,"Cella, D., Riley, W., Stone, A., Rothrock, N., Reeve, B., Yount, S., Amtmann, D., Bode, R., Buysse, D., Choi, S., Cook, K., DeVellis, R., DeWalt, D., Fries, J., Gershon, R., Hahn, E., Pilkonis, P., Revicki, D., Rose, M., Weinfurt, K., and Hays, R. on behalf of the PROMIS Cooperative Group. (2010) Initial adult health item banks and first wave testing of the patient-reported outcomes measurement information system (PROMIS™) Network: 2005–2008. Journal of Clinical Epidemiology. 63 (11): 1179-1194. pmid: PMC2965562",CC0 1.0,Public,CC0 1.0,,bd,2-2-2024,Health/Well-being,Unknown,U.S. general population and multiple disease populations,PROMIS domains,Unknown,Unknown,Survey-based,Health Assessment,Unknown,U.S.-based
promis1wave1_cesd,Data from the CESD Scale in the Wave 1 PROMIS study. ,https://dataverse.harvard.edu/dataset.xhtml?persistentId=hdl:1902.1/21134,"Cella, D., Riley, W., Stone, A., Rothrock, N., Reeve, B., Yount, S., Amtmann, D., Bode, R., Buysse, D., Choi, S., Cook, K., DeVellis, R., DeWalt, D., Fries, J., Gershon, R., Hahn, E., Pilkonis, P., Revicki, D., Rose, M., Weinfurt, K., and Hays, R. on behalf of the PROMIS Cooperative Group. (2010) Initial adult health item banks and first wave testing of the patient-reported outcomes measurement information system (PROMIS™) Network: 2005–2008. Journal of Clinical Epidemiology. 63 (11): 1179-1194. pmid: PMC2965562",CC0 1.0,Public,CC0 1.0,,bd,2-2-2024,Health/Well-being,Unknown,U.S. general population and multiple disease populations,PROMIS domains,Unknown,Unknown,Survey-based,Unknown,Unknown,U.S.-based
promis1wave1_fatigue,Data from the fatigue Scale in the Wave 1 PROMIS study. ,https://dataverse.harvard.edu/dataset.xhtml?persistentId=hdl:1902.1/21134,"Cella, D., Riley, W., Stone, A., Rothrock, N., Reeve, B., Yount, S., Amtmann, D., Bode, R., Buysse, D., Choi, S., Cook, K., DeVellis, R., DeWalt, D., Fries, J., Gershon, R., Hahn, E., Pilkonis, P., Revicki, D., Rose, M., Weinfurt, K., and Hays, R. on behalf of the PROMIS Cooperative Group. (2010) Initial adult health item banks and first wave testing of the patient-reported outcomes measurement information system (PROMIS™) Network: 2005–2008. Journal of Clinical Epidemiology. 63 (11): 1179-1194. pmid: PMC2965562",CC0 1.0,Public,CC0 1.0,,bd,2-2-2024,Health/Well-being,Unknown,U.S. general population and multiple disease populations,PROMIS domains,Unknown,Unknown,Survey-based,Unknown,Unknown,U.S.-based
promis1wave1_pain,Data from the pain Scale in the Wave 1 PROMIS study. ,https://dataverse.harvard.edu/dataset.xhtml?persistentId=hdl:1902.1/21134,"Cella, D., Riley, W., Stone, A., Rothrock, N., Reeve, B., Yount, S., Amtmann, D., Bode, R., Buysse, D., Choi, S., Cook, K., DeVellis, R., DeWalt, D., Fries, J., Gershon, R., Hahn, E., Pilkonis, P., Revicki, D., Rose, M., Weinfurt, K., and Hays, R. on behalf of the PROMIS Cooperative Group. (2010) Initial adult health item banks and first wave testing of the patient-reported outcomes measurement information system (PROMIS™) Network: 2005–2008. Journal of Clinical Epidemiology. 63 (11): 1179-1194. pmid: PMC2965562",CC0 1.0,Public,CC0 1.0,,bd,2-2-2024,Health/Well-being,Unknown,U.S. general population and multiple disease populations,PROMIS domains,Unknown,Unknown,Survey-based,Unknown,Unknown,U.S.-based
promis1wave1_social,Data from the social roles & social activities Scales in the Wave 1 PROMIS study. ,https://dataverse.harvard.edu/dataset.xhtml?persistentId=hdl:1902.1/21134,"Cella, D., Riley, W., Stone, A., Rothrock, N., Reeve, B., Yount, S., Amtmann, D., Bode, R., Buysse, D., Choi, S., Cook, K., DeVellis, R., DeWalt, D., Fries, J., Gershon, R., Hahn, E., Pilkonis, P., Revicki, D., Rose, M., Weinfurt, K., and Hays, R. on behalf of the PROMIS Cooperative Group. (2010) Initial adult health item banks and first wave testing of the patient-reported outcomes measurement information system (PROMIS™) Network: 2005–2008. Journal of Clinical Epidemiology. 63 (11): 1179-1194. pmid: PMC2965562",CC0 1.0,Public,CC0 1.0,,bd,2-2-2024,Health/Well-being,Unknown,U.S. general population and multiple disease populations,Social Roles & Social Activities,Unknown,Unknown,Survey-based,Unknown,Unknown,U.S.-based
promis1wave1_anxiety,Data from the anxiety Scale in the Wave 1 PROMIS study. ,https://dataverse.harvard.edu/dataset.xhtml?persistentId=hdl:1902.1/21134,"Cella, D., Riley, W., Stone, A., Rothrock, N., Reeve, B., Yount, S., Amtmann, D., Bode, R., Buysse, D., Choi, S., Cook, K., DeVellis, R., DeWalt, D., Fries, J., Gershon, R., Hahn, E., Pilkonis, P., Revicki, D., Rose, M., Weinfurt, K., and Hays, R. on behalf of the PROMIS Cooperative Group. (2010) Initial adult health item banks and first wave testing of the patient-reported outcomes measurement information system (PROMIS™) Network: 2005–2008. Journal of Clinical Epidemiology. 63 (11): 1179-1194. pmid: PMC2965562",CC0 1.0,Public,CC0 1.0,,bd,2-2-2024,Health/Well-being,Unknown,U.S. general population and multiple disease populations,PROMIS domains,Unknown,Unknown,Survey-based,Unknown,Unknown,U.S.-based
promis1wave1_depression,Data from the depression Scale in the Wave 1 PROMIS study. ,https://dataverse.harvard.edu/dataset.xhtml?persistentId=hdl:1902.1/21134,"Cella, D., Riley, W., Stone, A., Rothrock, N., Reeve, B., Yount, S., Amtmann, D., Bode, R., Buysse, D., Choi, S., Cook, K., DeVellis, R., DeWalt, D., Fries, J., Gershon, R., Hahn, E., Pilkonis, P., Revicki, D., Rose, M., Weinfurt, K., and Hays, R. on behalf of the PROMIS Cooperative Group. (2010) Initial adult health item banks and first wave testing of the patient-reported outcomes measurement information system (PROMIS™) Network: 2005–2008. Journal of Clinical Epidemiology. 63 (11): 1179-1194. pmid: PMC2965562",CC0 1.0,Public,CC0 1.0,,bd,2-2-2024,Health/Well-being,Unknown,U.S. general population and multiple disease populations,PROMIS domains,Unknown,Cross-sectional,Survey-based,Unknown,Unknown,U.S.-based
promis1wave1_haq,Data from the HAQ disability Scale in the Wave 1 PROMIS study. ,https://dataverse.harvard.edu/dataset.xhtml?persistentId=hdl:1902.1/21134,"Cella, D., Riley, W., Stone, A., Rothrock, N., Reeve, B., Yount, S., Amtmann, D., Bode, R., Buysse, D., Choi, S., Cook, K., DeVellis, R., DeWalt, D., Fries, J., Gershon, R., Hahn, E., Pilkonis, P., Revicki, D., Rose, M., Weinfurt, K., and Hays, R. on behalf of the PROMIS Cooperative Group. (2010) Initial adult health item banks and first wave testing of the patient-reported outcomes measurement information system (PROMIS™) Network: 2005–2008. Journal of Clinical Epidemiology. 63 (11): 1179-1194. pmid: PMC2965562",CC0 1.0,Public,CC0 1.0,,bd,2-2-2024,Health/Well-being,Unknown,U.S. general population and multiple disease populations,PROMIS domains,Unknown,Unknown,Survey-based,Unknown,Unknown,U.S.-based
promis1wave1_physicalfunction,Data from the physical functioning Scale in the Wave 1 PROMIS study. ,https://dataverse.harvard.edu/dataset.xhtml?persistentId=hdl:1902.1/21134,"Cella, D., Riley, W., Stone, A., Rothrock, N., Reeve, B., Yount, S., Amtmann, D., Bode, R., Buysse, D., Choi, S., Cook, K., DeVellis, R., DeWalt, D., Fries, J., Gershon, R., Hahn, E., Pilkonis, P., Revicki, D., Rose, M., Weinfurt, K., and Hays, R. on behalf of the PROMIS Cooperative Group. (2010) Initial adult health item banks and first wave testing of the patient-reported outcomes measurement information system (PROMIS™) Network: 2005–2008. Journal of Clinical Epidemiology. 63 (11): 1179-1194. pmid: PMC2965562",CC0 1.0,Public,CC0 1.0,,bd,2-2-2024,Health/Well-being,Unknown,U.S. general population and multiple disease populations,Physical Functioning,Unknown,Cross-sectional,Survey-based,Unknown,Unknown,U.S.-based
alcoholresearch_sumscore,Alcohol use disorder scale,https://figshare.com/collections/Evaluating_the_cost_of_simplicity_in_score_building_An_example_from_alcohol_research/6949991,"Rousson, V., Trächsel, B., Iglesias, K., & Baggio, S. (2023). Evaluating the cost of simplicity in score building: An example from alcohol research. Plos one, 18(11), e0294671.",CC-BY,Public,CC-BY,,bd,2-15-2024,Health/Well-being,Dichotomous,Young Swiss men,Alcohol Use Disorder,"Logistic Regression, LASSO, Ridge Penalty",Unknown,Questionnaire-based,Psychology and Health Sciences,Binary questions,Switzerland
novelobjectmatching,Object matching tasks,https://osf.io/pv6ye/,"Growns, B., Towler, A., & Martire, K. (2023). The novel object-matching test (NOM Test): A psychometric measure of visual comparison ability. Behavior research methods, 1-10.",CC BY 4.0,Public,CC BY 4.0,,yuhang,2-28-2024,Unknown,Unknown,Unknown,Unknown,Unknown,Unknown,Unknown,Unknown,Unknown,Unknown
concretewords,Concreteness (is word's meaning understood through perception and action) of expressions,https://osf.io/ksypa/,"Muraki, E. J., Abdalla, S., Brysbaert, M., & Pexman, P. M. (2023). Concreteness ratings for 62,000 English multiword expressions. Behavior Research Methods, 55(5), 2522-2531.",CC-By Attribution 4.0 International,Public,CC-By Attribution 4.0 International,,,3-7-2024,Unknown,Unknown,Unknown,Unknown,Unknown,Unknown,Unknown,Unknown,Unknown,Unknown
anxiety_gastro_symptoms,Anxiety regarding gastrointestinal symptoms for those with eating pathology,https://osf.io/gh624/?view_only=368337e779ea4ab9b6eea1532b582d43,"Forney, K. J., Burton Murray, H., Brown, T. A., Guadagnoli, L., Pucci, G., & Taft, T. (2023). Validation of a measure of hypervigilance and anxiety about gastrointestinal symptoms for individuals with elevated eating pathology. Psychological Assessment.",CC-By Attribution 4.0 International ,Public,CC-By Attribution 4.0 International ,,bd,,Health/Well-being,Unknown,Unknown,Unknown,Unknown,Unknown,Unknown,Unknown,Unknown,Unknown
DEMOS,Ratings of human body movements averaged across raters on four dimensions,https://osf.io/83fst/,"Zhang, M., Yu, L., Zhang, K., Du, B., Zhan, B., Jia, S., ... & Luo, W. (2023). Construction and validation of the Dalian emotional movement open-source set (DEMOS). Behavior Research Methods, 55(5), 2353-2366.",CC-By Attribution 4.0 International,Public,CC-By Attribution 4.0 International,,bd/annie,3-6-2024,Unknown,Unknown,Unknown,Unknown,Unknown,Unknown,Unknown,Unknown,Unknown,Unknown
nbashots,NBA shots by player,https://github.com/DomSamangy/NBA_Shots_04_23,,,,,,bd,3-8-2024,Sports Analytics,Continuous,NBA Players,Basketball Shot Location,Unknown,Cross-sectional,Behavioral Task-based,Sports Performance Analysis,Unknown,U.S.-based
AAQ-II,Measure of Experiential avoidance,https://osf.io/43dfq/?view_only=a97186042d6a474aad93880b183935fc,"Langer, Á. I., Ponce, F. P., Ordóñez-Carrasco, J. L., Fuentes-Ferrada, R., Mac-Ginty, S., Gaete, J., & Núñez, D. (2024). Psychometric evidence of the Acceptance and Action Questionnaire-II (AAQ-II): an item response theory analysis in university students from Chile. BMC psychology, 12(1), 111.",,,,,bd/annie,3-11-2024,Health/Well-being,Unknown,Unknown,Unknown,Unknown,Unknown,Unknown,Unknown,Unknown,Unknown
hmcdm_spatialreasoning,Data from a spatial reasoning task (fifth wave of data collection),https://cran.r-project.org/web/packages/hmcdm/index.html,"Zhang S, Wang S, Chen Y, Kwon S (2023). _hmcdm: Hidden Markov Cognitive Diagnosis Models for Learning_. R package version  2.1.1, <https://CRAN.R-project.org/package=hmcdm>.",GPL-2 | GPL-3,Public,GPL-3,Data reformatted from original on 3-13-2024.,bd,,Cognitive Skills,Response Time,Unknown,Spatial Reasoning,Unknown,Unknown,Behavioral Task-based,Educational Assessment,Unknown,Unknown
fractals_rating,Responses related to abstract fractals,https://osf.io/ckfmv/,"Ovalle-Fresa, R., Di Pietro, S. V., Reber, T. P., Balbi, E., & Rothen, N. (2022). Standardized database of 400 complex abstract fractals. Behavior Research Methods, 54(5), 2302-2317.",CC-By Attribution 4.0 International ,Public,CC-By Attribution 4.0 International ,,bd/annie,3-26-2024,Unknown,Unknown,Unknown,Unknown,Unknown,Unknown,Unknown,Unknown,Unknown,Unknown
Resistance,Data from the resistance to framing scale,https://osf.io/j5n6f/,"Geiger, S.J., Vintr, J. & Rachev, N.R. A reassessment of the Resistance to Framing scale. Behav Res 55, 2320–2332 (2023). https://doi.org/10.3758/s13428-022-01876-7",CC-By Attribution 4.0 International ,Public,CC-By Attribution 4.0 International ,,,,Unknown,Unknown,Unknown,Unknown,Unknown,Unknown,Unknown,Unknown,Unknown,Unknown
Veterans.Affairs.SSVF.Survey.2016-17,VA Satisfaction survey related to supportive services for low-income veterans (2016-2017),https://github.com/data-liberation-project/va-ssvf-survey-data,https://www.data-liberation-project.org/datasets/va-ssvf-survey-data/, CC BY-SA 4.0 ,Public, CC BY-SA 4.0 ,,bd/lynn99kek,3-26-2024,Health/Well-being,Unknown,Low-income veterans,Satisfaction with supportive services,Unknown,Unknown,Survey-based,Department of Veteran Affairs (VA) Supportive Services for Veteran Families (SSVF) satisfaction surveys,Unknown,U.S.-based
Veterans.Affairs.SSVF.Survey.2018-20,VA Satisfaction survey related to supportive services for low-income veterans (2-18-2020),https://github.com/data-liberation-project/va-ssvf-survey-data,https://www.data-liberation-project.org/datasets/va-ssvf-survey-data/, CC BY-SA 4.0 ,Public, CC BY-SA 4.0 ,,bd/lynn99kek,3-27-2024,Health/Well-being,Unknown,Low-income veterans,Satisfaction with supportive services,Unknown,Unknown,Survey-based,Veteran Affairs Supportive Services evaluation,Unknown,U.S.-based
spelling.assessment_study1,Data from a spelling test,https://osf.io/7tuwr/?view_only=c62d60752bbd48fa8dd7cc3ee092ea51,"Eskenazi, M. A., Askew, R. L., & Folk, J. R. (2023). Precision in the measurement of lexical expertise: the selection of optimal items for a spelling assessment. Behavior Research Methods, 55(2), 623-632.",,,,,bd/annie,3-28-2024,Educational Ability,Unknown,Unknown,Cognitive Skills,Unknown,Unknown,Test-based,Educational Assessment,Unknown,Unknown
spelling.assessment_study2,Data from a spelling test,https://osf.io/7tuwr/?view_only=c62d60752bbd48fa8dd7cc3ee092ea51,"Eskenazi, M. A., Askew, R. L., & Folk, J. R. (2023). Precision in the measurement of lexical expertise: the selection of optimal items for a spelling assessment. Behavior Research Methods, 55(2), 623-632.",,,,,bd/annie,3-28-2024,Educational Ability,Unknown,Unknown,Cognitive Skills,Unknown,Unknown,Test-based,Educational Assessment,Unknown,Unknown
mft_validationandreplication,Moral Foundations Questionnairre,https://osf.io/2pkaw/,"Zakharin, M., & Bates, T. C. (2023). Moral Foundations Theory: Validation and replication of the MFQ-2. Personality and Individual Differences, 214, 112339.",C-By Attribution 4.0 International,Public,C-By Attribution 4.0 International,,bd,3-28-2024,Unknown,Unknown,Unknown,Unknown,Unknown,Unknown,Unknown,Unknown,Unknown,Unknown
criticalperiod_syntax,Syntax questions,https://osf.io/vab8j/,"Chen, T., & Hartshorne, J. K. (2021). More evidence from over 1.1 million subjects that the critical period for syntax closes in late adolescence. Cognition, 214, 104706.",CC-By Attribution 4.0 ,Public,CC-By Attribution 4.0 ,,bd,3-28-2024,Unknown,Unknown,Unknown,Unknown,Unknown,Unknown,Unknown,Unknown,Unknown,Unknown
fictionexposure_wimmer,Author recognition,https://osf.io/ytudn/,"Wimmer, L., & Ferguson, H. J. (2023). Testing the validity of a self-report scale, author recognition test, and book counting as measures of lifetime exposure to print fiction. Behavior Research Methods, 55(1), 103-134.",CC BY 4.0,Public,CC BY 4.0,email 4-10-2024,bd,3-28-2024,Unknown,Unknown,Unknown,Unknown,Unknown,Unknown,Unknown,Unknown,Unknown,Unknown
scoliosis_dueber,Scoliosis Quality of Life Index,https://osf.io/3qt5s/,"Dueber, D. M., & Toland, M. D. (2023). A bifactor approach to subscore assessment. Psychological Methods, 28(1), 222–241. https://doi.org/10.1037/met0000459",CC-By Attribution 4.0 International ,Public,CC-By Attribution 4.0 International ,,bd,4-15-2024,Health/Well-being,Unknown,Unknown,Unknown,Unknown,Unknown,Unknown,Unknown,Unknown,Unknown
orev_bohn2024,Open receptive vocab task for 3-8 year old children,https://github.com/ccp-eva/orev/,"Bohn, M., Prein, J., Koch, T. et al. oREV: An item response theory-based open receptive vocabulary task for 3- to 8-year-old children. Behav Res 56, 2595–2605 (2024). https://doi.org/10.3758/s13428-023-02169-3",CC-BY-4.0 license,Public,CC-BY-4.0 license,,bd,4-4-2024,Educational Ability,Unknown,Children (3-8 years old),Cognitive Skills,Unknown,Unknown,Behavioral Task-based,Educational Assessment,Unknown,Unknown
face_identification_jeckeln2023,Data from Triad Identity Matching (TIM) tasks.,https://osf.io/yruvk/?view_only=4e4ae41ae25c4b4cba113a62660df231,"Jeckeln, G., Hu, Y., Cavazos, J. G., Yates, A. N., Hahn, C. A., Tang, L., ... & O’Toole, A. J. (2024). Face identification proficiency test designed using item response theory. Behavior Research Methods, 56(3), 1244-1259.",,,,,,,Unknown,Unknown,Unknown,Unknown,Unknown,Unknown,Unknown,Unknown,Unknown,Unknown
WMI_Rot_Han,Working memory tasks focused on rotation.,https://osf.io/bhw87/,"Navarro, E., Hao, H., Rosales, K. P., & Conway, A. R. (2023). An item response theory approach to the measurement of working memory capacity. Behavior Research Methods, 1-18.",CC-By Attribution 4.0 International,Public,CC-By Attribution 4.0 International,,bd,6-10-2024,Cognitive Skills,Unknown,Unknown,Unknown,Unknown,Unknown,Unknown,Unknown,Unknown,Unknown
WMI_Read_Han,Working memory tasks focused on reading.,https://osf.io/bhw87/,"Navarro, E., Hao, H., Rosales, K. P., & Conway, A. R. (2023). An item response theory approach to the measurement of working memory capacity. Behavior Research Methods, 1-18.",CC-By Attribution 4.0 International,Public,CC-By Attribution 4.0 International,,bd,6-10-2024,Working Memory Tasks,Unknown,Unknown,Cognitive Skills,Unknown,Unknown,Unknown,Unknown,Unknown,Unknown
previc_bohn2023.R,Parent reports of expressive vocabulary,https://github.com/manuelbohn/previc,"Bohn, M., Prein, J. C., Engicht, J., Haun, D., Gagarina, N., & Koch, T. (2023, October 19). PREVIC: An adaptive parent report measure of expressive vocabulary in children between 3 and 8 years of age. https://doi.org/10.31234/osf.io/hvncp",CC-BY-4.0 license,Public,CC-BY-4.0 license,,bd,7-2-2024,Unknown,Unknown,Unknown,Unknown,Unknown,Unknown,Unknown,Unknown,Unknown,Unknown
realpic_souza2021,Picture norms of common items,https://osf.io/qn35s/?view_only=9c209e9236b94b2cb74f77f47e7ff390,"Souza, C., Garrido, M.V., Saraiva, M. et al. RealPic: Picture norms of real-world common items. Behav Res 53, 1746–1761 (2021). https://doi.org/10.3758/s13428-020-01523-z",email permission,Public,CC BY 4.0,email  sent 7-2,bd/annie,7-2-2024,Unknown,Unknown,Unknown,Unknown,Unknown,Unknown,Unknown,Unknown,Unknown,Unknown
wooly_hartman2022,Test of era-based knowledge using popular songs,https://osf.io/bn4xy/?view_only=7252e963f3bd4c0c981eed6ddd085ee8,"Hartman, R., Moss, A.J., Rabinowitz, I. et al. Do you know the Wooly Bully? Testing era-based knowledge to verify participant age online. Behav Res 55, 3313–3325 (2023). https://doi.org/10.3758/s13428-022-01944-y",CC-By Attribution 4.0 International ,Public,CC-By Attribution 4.0 International ,,bd,7-12-2024,Unknown,Unknown,Unknown,Unknown,Unknown,Unknown,Unknown,Unknown,Unknown,Unknown
ravens_deboeck2012,Raven's matrices,https://www.jstatsoft.org/article/view/v048c01,"De Boeck, P., & Partchev, I. (2012). IRTrees: Tree-based item response models of the GLMM family. Journal of Statistical Software, 48, 1-28.",GPL General Public License version 2 or version 3 or a GPL-compatible license,Public,GPL 3.0,Data reformatted from original on 8-27-2024,bd/arthur pan,8-27-2024,Cognitive Skills,Unknown,Unknown,Unknown,Unknown,Unknown,Unknown,Unknown,Unknown,Unknown
stress_deboeck2012,Fear and stress items from the Output Questionnaire,https://www.jstatsoft.org/article/view/v048c01,"De Boeck, P., & Partchev, I. (2012). IRTrees: Tree-based item response models of the GLMM family. Journal of Statistical Software, 48, 1-28.",GPL General Public License version 2 or version 3 or a GPL-compatible license,Public,GPL 3.0,Data reformatted from original on 8-27-2024,bd/arthur pan,8-27-2024,Fear and stress,Unknown,Unknown,Affective Measures,Unknown,Unknown,Output Questionnaire,Unknown,Unknown,Unknown
Mechanical_Turk_Lexical,Lexical decisions tasks from Mturkers,https://osf.io/za9y8/,"Ratcliff, R., Hendrickson, A.T. Do data from mechanical Turk subjects replicate accuracy, response time, and diffusion modeling results?. Behav Res 53, 2302–2325 (2021). https://doi.org/10.3758/s13428-021-01573-x",,Public,CC BY 4.0,Agreed via email 8-29-2024 (from ratcliff.22@osu.edu),bd/arthur pan,8-29-2024,,,,,,,Behavioral Task-based,,,Unknown
Mechanical_Turk_Recognition,Item recognition tasks from Mturkers,https://osf.io/za9y8/,"Ratcliff, R., Hendrickson, A.T. Do data from mechanical Turk subjects replicate accuracy, response time, and diffusion modeling results?. Behav Res 53, 2302–2325 (2021). https://doi.org/10.3758/s13428-021-01573-x",,Public,CC BY 4.0,Agreed via email 8-29-2024 (from ratcliff.22@osu.edu),bd/arthur pan,8-29-2024,Unknown,Unknown,Unknown,Unknown,Unknown,Unknown,Unknown,Unknown,Unknown,Unknown
AMI_CV_Hewitt2024,Apathy Motivation Index–Child Version ,https://osf.io/t5js9/,"Hewitt, S.R., Habicht, J., Bowler, A. et al. Probing apathy in children and adolescents with the Apathy Motivation Index–Child version. Behav Res 56, 3982–3994 (2024). https://doi.org/10.3758/s13428-023-02184-4",CC-By Attribution 4.0 International,Public,CC-By Attribution 4.0 International,,bd/arthur pan,8-29-2024,Unknown,Unknown,Children,Unknown,Unknown,Unknown,Unknown,Unknown,Unknown,Unknown
